{
    "input_image": "https://files.catbox.moe/wy4gq7.jpg",
    "prompt": "A woman adorned with a delicate flower crown, is standing amidst a field of gently swaying wildflowers. Her eyes sparkle with a serene gaze, and a faint smile graces her lips, suggesting a moment of peaceful contentment. The shot is framed from the waist up, highlighting the gentle breeze lightly tousling her hair. The background reveals an expansive meadow under a bright blue sky, capturing the tranquility of a sunny afternoon.",
    "num_inference_steps": 50,
    "guidance_scale": 7.0,
    "seed": 0
}